address;opentime;endtime;phone
клх Нижний Тагил, ул. Тимирязева, д. 83, 515267;08:30:00;20:30:00;+7 (414) 075-35-76
г. Тобольск, ул. Котовского, д. 76, 576898;08:30:00;20:30:00;8 143 023 94 80
д. Моршанск, ул. К.Маркса, д. 72, 861332;09:00:00;21:00:00;8 (930) 814-9101
к. Выборг, ул. Краснодарская, д. 75, 113193;09:00:00;21:00:00;+7 (591) 028-00-83
с. Вязьма, ул. Прохладная, д. 46, 499852;08:00:00;20:00:00;85842526258
клх Морозовск, ул. Достоевского, д. 08, 382793;08:00:00;20:00:00;8 263 610 84 85
д. Кедровый, ул. Некрасова, д. 44, 016238;08:30:00;20:30:00;+7 (382) 469-7266
ст. Моршанск, ул. 9 Января, д. 36, 895636;08:00:00;20:00:00;8 110 676 73 34
к. Бомнак, ул. Короткая, д. 27, 935993;09:00:00;21:00:00;8 (933) 937-8169
к. Аршан (Бурят.), ул. Фурманова, д. 58, 219141;09:00:00;21:00:00;8 (800) 778-53-83
клх Псков, ул. Союзная, д. 92, 602111;08:30:00;20:30:00;+7 (533) 740-98-37
с. Великие Луки, ул. Терешковой, д. 01, 771866;08:00:00;20:00:00;+7 (597) 821-06-98
к. Нефедова, ул. Новоселов, д. 10, 826757;09:00:00;21:00:00;+7 (319) 068-98-90
г. Луховицы, ул. Короткая, д. 53, 048905;08:30:00;20:30:00;+7 (245) 772-85-70
ст. Лагань, ул. Осенняя, д. 28, 589524;08:30:00;20:30:00;8 (485) 491-2761
ст. Ступино, ул. Матросова, д. 84, 498677;08:30:00;20:30:00;8 (689) 917-99-78
клх Усолье Сибирское, ул. Леонова, д. 51, 016505;09:00:00;21:00:00;8 (733) 279-91-76
ст. Заводоуковск, ул. Мелиоративная, д. 41, 082568;09:00:00;21:00:00;+7 157 684 65 38
г. Псебай, ул. Минина, д. 06, 100546;08:00:00;20:00:00;+7 847 926 7626
ст. Арсеньев, ул. Волочаевская, д. 88, 180673;08:30:00;20:30:00;+74300781731
д. Камышин, ул. Строителей, д. 82, 796605;08:30:00;20:30:00;8 (183) 376-92-91
д. Абакан, ул. Профсоюзная, д. 06, 256308;09:00:00;21:00:00;+7 095 596 63 11
клх Красноуфимск, ул. Новосельская, д. 16, 468320;08:30:00;20:30:00;+77379878618
г. Томск, ул. Лунная, д. 17, 748396;09:00:00;21:00:00;+7 (618) 736-2044
ст. Тутаев, ул. Чайковского, д. 61, 391127;08:30:00;20:30:00;+7 620 164 67 94
д. Шумиха, ул. Коммунистическая, д. 26, 648156;09:00:00;21:00:00;8 (652) 374-9105
г. Снежинск, ул. Энергетическая, д. 84, 098876;09:00:00;21:00:00;8 730 050 58 35
клх Поярково, ул. Троицкая, д. 31, 577612;09:00:00;21:00:00;8 (192) 686-3901
клх Котельнич, ул. Черняховского, д. 97, 107501;08:30:00;20:30:00;+7 (120) 272-2267
ст. Моршанск, ул. Павлова, д. 14, 981844;08:30:00;20:30:00;8 (191) 532-80-88
к. Кингисепп, ул. Вишневая, д. 50, 563671;09:00:00;21:00:00;87227140283
г. Курган, ул. Северная, д. 43, 822750;08:00:00;20:00:00;+7 124 358 72 98
г. Сунтар, ул. Урожайная, д. 89, 524454;09:00:00;21:00:00;+7 897 741 7466
ст. Александров, ул. Мичурина, д. 40, 231056;08:30:00;20:30:00;+7 (325) 291-0334
ст. Луга, ул. Красноярская, д. 34, 563980;08:00:00;20:00:00;+7 204 474 17 50
п. Пенза, ул. Курортная, д. 83, 320844;08:30:00;20:30:00;+7 (535) 625-77-75
п. Ангарск, ул. Радищева, д. 05, 110137;09:00:00;21:00:00;8 518 517 8085
с. Амурск, ул. Вокзальная, д. 23, 644665;08:30:00;20:30:00;8 970 105 6226
г. Ханты-Мансийск, ул. Урожайная, д. 92, 591750;08:30:00;20:30:00;8 (008) 301-47-62
п. Минусинск, ул. Тенистая, д. 11, 856716;08:30:00;20:30:00;8 (050) 453-4356
г. Ступино, ул. Пархоменко, д. 00, 713296;08:00:00;20:00:00;+7 (852) 204-8173
ст. Гремячинск (Бурят.), ул. Пушкинская, д. 54, 711438;08:30:00;20:30:00;8 264 017 0989
г. Тымовское, ул. Рабочая, д. 86, 611001;09:00:00;21:00:00;89111242516
к. Долинск, ул. Парковая, д. 42, 186455;08:00:00;20:00:00;+7 (715) 999-7227
д. Черский, ул. Фадеева, д. 91, 705200;08:30:00;20:30:00;+7 445 374 3494
п. Ишим, ул. Советская, д. 31, 149096;09:00:00;21:00:00;8 464 929 8102
п. Ессентуки, ул. Красноярская, д. 18, 295057;08:00:00;20:00:00;83406139393
клх Соликамск, ул. Семашко, д. 19, 696749;08:00:00;20:00:00;8 135 069 92 02
г. Фатеж, ул. Дружбы, д. 12, 374516;09:00:00;21:00:00;+7 615 000 4046
п. Мостовской, ул. Шишкина, д. 29, 221851;09:00:00;21:00:00;+7 427 420 9510
клх Калининград, ул. Островского, д. 82, 751899;08:30:00;20:30:00;82280651874
к. Кежма, ул. ДОС, д. 02, 278065;09:00:00;21:00:00;+7 (423) 923-3265
г. Новосибирск, ул. Северная, д. 08, 154030;09:00:00;21:00:00;+7 (616) 114-19-29
п. Калач-на-Дону, ул. Веселая, д. 31, 511076;08:30:00;20:30:00;+7 641 048 28 27
г. Красновишерск, ул. Таежная, д. 09, 117156;08:30:00;20:30:00;+7 (007) 476-3775
п. Завьялиха, ул. Гоголя, д. 90, 015274;08:30:00;20:30:00;85473543426
клх Владикавказ, ул. Кубанская, д. 54, 596395;08:30:00;20:30:00;+7 (639) 108-6211
клх Белорецк, ул. Разина, д. 45, 225426;08:30:00;20:30:00;+7 (100) 274-8602
с. Корсаков, ул. Невского, д. 18, 957015;09:00:00;21:00:00;8 (744) 055-7507
к. Муром, ул. Семашко, д. 30, 338017;09:00:00;21:00:00;+7 (514) 428-0664
ст. Камень-на-Оби, ул. Морская, д. 21, 278647;09:00:00;21:00:00;+7 (840) 883-0183
клх Игнашино, ул. Панфилова, д. 41, 780670;09:00:00;21:00:00;8 939 350 1802
к. Бугуруслан, ул. Войкова, д. 72, 579659;09:00:00;21:00:00;8 (173) 626-4521
п. Орехово-Зуево, ул. Васильковая, д. 36, 814737;08:00:00;20:00:00;+7 (326) 060-8065
д. Владимир, ул. Баумана, д. 68, 326112;08:30:00;20:30:00;+7 (070) 982-02-22
п. Губаха, ул. Правды, д. 50, 758760;09:00:00;21:00:00;+7 653 349 26 93
ст. Сунтар, ул. Детская, д. 32, 393042;08:30:00;20:30:00;8 (202) 075-23-47
д. Минеральные Воды, ул. Черемуховая, д. 39, 503795;09:00:00;21:00:00;+7 635 961 0450
г. Ханты-Мансийск, ул. Инженерная, д. 34, 054450;08:30:00;20:30:00;+7 190 493 9146
с. Балашиха, ул. Космонавтов, д. 08, 382374;08:00:00;20:00:00;8 (162) 699-48-41
д. Минусинск, ул. Томская, д. 41, 366926;08:30:00;20:30:00;+7 707 613 97 00
с. Любань, ул. Покровская, д. 66, 838443;08:00:00;20:00:00;+79397458860
ст. Нефтекамск, ул. Слободская, д. 82, 361700;09:00:00;21:00:00;+7 (346) 725-03-62
г. Калининград, ул. Олимпийская, д. 52, 479609;09:00:00;21:00:00;8 176 437 62 83
п. Железногорск(Курск.), ул. Одесская, д. 29, 882700;09:00:00;21:00:00;8 464 996 3202
п. Ставрополь, ул. Гоголя, д. 79, 472261;08:30:00;20:30:00;+70457508662
ст. Балашов, ул. Аэродромная, д. 41, 562149;08:30:00;20:30:00;8 (795) 762-1226
п. Мокшан, ул. Речная, д. 44, 837987;09:00:00;21:00:00;8 (785) 068-01-52
г. Юрьевец (Иван.), ул. Октябрьская, д. 90, 258614;09:00:00;21:00:00;8 986 695 80 68
к. Кизел, ул. Высотная, д. 76, 987066;08:00:00;20:00:00;8 824 084 31 57
г. Шаховская, ул. Большевистская, д. 25, 210568;08:00:00;20:00:00;+7 (917) 803-4685
д. Тавда, ул. Подлесная, д. 29, 807386;08:30:00;20:30:00;+79431515704
ст. Любань, ул. Строительная, д. 95, 816491;09:00:00;21:00:00;89377659694
с. Стерлитамак, ул. Сахалинская, д. 19, 913482;08:00:00;20:00:00;+7 (382) 871-9258
клх Углич, ул. Логовая, д. 58, 360352;08:30:00;20:30:00;+7 (552) 881-01-83
д. Волгодонск, ул. Депутатская, д. 80, 859127;08:30:00;20:30:00;8 (402) 951-67-81
г. Старая Русса, ул. Мичурина, д. 46, 421364;08:30:00;20:30:00;+7 815 424 37 41
с. Шадринск, ул. Красноармейская, д. 21, 428864;09:00:00;21:00:00;8 291 008 0721
п. Катайск, ул. Нижняя, д. 26, 128476;09:00:00;21:00:00;+7 596 508 4689
ст. Щельяюр, ул. Урицкого, д. 00, 078206;09:00:00;21:00:00;+7 926 691 57 88
п. Славгород, ул. Советская, д. 72, 679738;09:00:00;21:00:00;+7 (373) 086-15-45
к. Черкесск, ул. Шаумяна, д. 30, 793767;09:00:00;21:00:00;84465247284
п. Черский, ул. Железнодорожная, д. 87, 503988;09:00:00;21:00:00;8 750 586 49 97
клх Североуральск, ул. Просвещения, д. 91, 887609;09:00:00;21:00:00;82137128256
клх Шадринск, ул. Ручейная, д. 93, 364142;08:00:00;20:00:00;+74854511092
г. Нефтегорск (Самар.), ул. Вахитова, д. 80, 500342;08:30:00;20:30:00;+7 198 449 58 44
клх Алапаевск, ул. Бажова, д. 82, 528329;09:00:00;21:00:00;+76420931180
ст. Кандалакша, ул. Советской Армии, д. 26, 440577;09:00:00;21:00:00;+79803422077
ст. Мирный, ул. Белорусская, д. 21, 915334;09:00:00;21:00:00;+7 612 476 37 88
с. Жигулевск, ул. Жукова, д. 46, 969996;09:00:00;21:00:00;8 (060) 612-83-12
к. Ачхой Мартан, ул. Карбышева, д. 25, 528830;09:00:00;21:00:00;8 552 193 0898
ст. Переславль-Залесский, ул. Маяковского, д. 49, 777280;08:30:00;20:30:00;8 (208) 337-04-33
клх Ухта, ул. Базарная, д. 03, 160325;08:30:00;20:30:00;+7 963 773 4890
ст. Нальчик, ул. Розы Люксембург, д. 20, 967482;09:00:00;21:00:00;+75719568023
с. Яр-Сале, ул. Коминтерна, д. 72, 971638;08:00:00;20:00:00;8 (381) 676-62-72
п. Внуково (метеост.), ул. Хвойная, д. 41, 139221;09:00:00;21:00:00;8 (811) 411-7739
к. Октябрьское (Челяб.), ул. Октябрьская, д. 88, 894064;08:30:00;20:30:00;8 (266) 211-16-60
г. Кизилюрт, ул. Челюскинцев, д. 56, 366331;08:30:00;20:30:00;+79253808120
с. Ессентуки, ул. Западная, д. 02, 318742;08:00:00;20:00:00;8 (380) 503-4816
д. Рославль, ул. Балтийская, д. 51, 278915;08:30:00;20:30:00;8 490 493 2458
к. Вологда, ул. Пирогова, д. 99, 811742;08:30:00;20:30:00;+75496159262
клх Екатеринбург, ул. Стахановская, д. 78, 542191;08:30:00;20:30:00;8 008 376 8598
клх Одинцово, ул. Тюленина, д. 02, 825345;08:00:00;20:00:00;+7 663 249 1815
п. Азов (Рост.), ул. Рябиновая, д. 02, 846742;08:30:00;20:30:00;+76791630440
г. Королев, ул. Карьерная, д. 65, 366595;09:00:00;21:00:00;+7 (947) 637-4379
г. Иваново, ул. Больничная, д. 99, 601157;08:00:00;20:00:00;8 623 510 31 58
ст. Тарко-Сале, ул. Есенина, д. 40, 173373;08:00:00;20:00:00;+76702541828
п. Луга, ул. Производственная, д. 23, 002347;08:00:00;20:00:00;+7 (780) 808-2122
д. Кежма, ул. Полтавская, д. 81, 920356;08:00:00;20:00:00;+7 (348) 690-8180
д. Прохладный, ул. Прудная, д. 63, 706455;08:30:00;20:30:00;+7 (014) 771-28-04
с. Каневская, ул. Шаумяна, д. 07, 637270;08:30:00;20:30:00;+7 442 093 18 71
д. Городовиковск, ул. Гражданская, д. 39, 691327;08:00:00;20:00:00;+7 651 278 71 93
п. Катайск, ул. Горняцкая, д. 08, 356723;08:00:00;20:00:00;+7 (679) 943-88-72
п. Тавда, ул. Тенистая, д. 56, 141823;08:30:00;20:30:00;+7 647 060 44 13
п. Волгоград, ул. Прибрежная, д. 86, 780293;08:00:00;20:00:00;8 (036) 663-3572
д. Осташков, ул. Подгорная, д. 58, 310352;09:00:00;21:00:00;+7 (308) 211-7584
д. Уссурийск, ул. Седова, д. 75, 351129;09:00:00;21:00:00;8 (338) 374-6965
г. Сладково, ул. Шолохова, д. 07, 401608;08:00:00;20:00:00;8 (789) 880-2240
п. Волгоград, ул. Осипенко, д. 76, 238302;08:30:00;20:30:00;+7 (132) 662-5167
к. Углегорск, ул. Водопроводная, д. 35, 444335;08:30:00;20:30:00;8 861 388 5205
ст. Лянтор, ул. Дарвина, д. 95, 810058;08:00:00;20:00:00;+7 668 654 9028
к. Холмск, ул. Покровская, д. 76, 294996;08:00:00;20:00:00;+70132171233
г. Лагань, ул. Портовая, д. 99, 260298;09:00:00;21:00:00;+77568075963
к. Светлогорск (Калин.), ул. Лазо, д. 23, 383391;08:00:00;20:00:00;8 (186) 361-7977
п. Сортавала, ул. Комарова, д. 71, 084838;09:00:00;21:00:00;8 (313) 360-55-57
г. Азов (Рост.), ул. Саратовская, д. 87, 886340;09:00:00;21:00:00;8 (873) 217-4242
п. Холмск, ул. Тупиковая, д. 80, 385498;09:00:00;21:00:00;+7 707 338 85 59
д. Сухиничи, ул. Достоевского, д. 90, 355873;09:00:00;21:00:00;+7 529 554 0753
к. Таганрог, ул. Молодежная, д. 76, 821732;09:00:00;21:00:00;+7 348 098 8162
г. Долинск, ул. Черноморская, д. 33, 022416;09:00:00;21:00:00;8 350 144 30 38
д. Северо-Курильск, ул. Космонавтов, д. 46, 587714;09:00:00;21:00:00;82404143540
ст. Грозный, ул. Заливная, д. 11, 216918;08:30:00;20:30:00;+7 209 247 63 27
с. Тверь, ул. Куйбышева, д. 40, 438205;08:00:00;20:00:00;8 161 958 38 63
п. Октябрьский (Башк.), ул. Промышленная, д. 89, 854203;08:00:00;20:00:00;8 894 463 45 66
д. Оленек, ул. Шевченко, д. 42, 630617;09:00:00;21:00:00;8 274 993 1297
п. Избербаш, ул. Парковая, д. 58, 169438;08:30:00;20:30:00;8 176 852 50 42
с. Вуктыл, ул. Химиков, д. 54, 681100;09:00:00;21:00:00;8 (618) 457-11-42
п. Кингисепп, ул. Заозерная, д. 83, 533517;08:00:00;20:00:00;+7 (530) 319-6180
ст. Томари, ул. Рыбацкая, д. 70, 451686;09:00:00;21:00:00;+7 396 156 0691
клх Аршан (Бурят.), ул. Королева, д. 79, 863603;08:30:00;20:30:00;88030998963
с. Тюмень, ул. Ставропольская, д. 70, 072263;08:00:00;20:00:00;+77534524090
п. Теберда, ул. Театральная, д. 42, 764870;08:00:00;20:00:00;+7 (925) 280-89-26
клх Кисловодск, ул. Нефтяников, д. 94, 659550;09:00:00;21:00:00;8 838 992 6967
г. Набережные Челны, ул. Пушкина, д. 05, 994395;09:00:00;21:00:00;8 (680) 268-22-82
клх Усть-Катав, ул. Ульянова, д. 39, 118728;08:30:00;20:30:00;+7 325 072 27 07
ст. Губкинский, ул. Красина, д. 90, 314592;08:00:00;20:00:00;+79599258149
ст. Усть-Ордынский, ул. Коммунаров, д. 34, 618443;08:30:00;20:30:00;8 896 638 94 10
д. Сузун, ул. Большевистская, д. 03, 219668;09:00:00;21:00:00;8 433 333 5145
ст. Юрюзань, ул. Войкова, д. 27, 483866;08:00:00;20:00:00;+7 (925) 395-88-22
клх Терскол, ул. Короленко, д. 75, 086591;09:00:00;21:00:00;8 (960) 197-3542
д. Сасово, ул. Полтавская, д. 15, 419687;08:00:00;20:00:00;8 (135) 027-1325
ст. Плес, ул. Некрасова, д. 80, 521359;08:30:00;20:30:00;+7 (490) 287-2988
п. Усть-Калманка, ул. Флотская, д. 97, 897521;08:00:00;20:00:00;+7 496 831 8405
ст. Теберда, ул. Детская, д. 37, 709994;09:00:00;21:00:00;83471374983
клх Витим, ул. Волжская, д. 05, 557203;08:00:00;20:00:00;+7 (780) 292-90-62
д. Волгоград, ул. Кузнечная, д. 30, 860561;09:00:00;21:00:00;+73261761631
п. Игнашино, ул. Песочная, д. 42, 677259;09:00:00;21:00:00;+7 (659) 279-98-33
д. Вытегра, ул. Кооперативная, д. 84, 059741;08:00:00;20:00:00;81474747070
с. Рыбинск, ул. Южная, д. 04, 712797;08:30:00;20:30:00;+7 (679) 105-22-58
клх Благовещенск (Амур.), ул. Толстого, д. 19, 213747;08:00:00;20:00:00;8 (331) 177-99-70
г. Чермоз, ул. Красноярская, д. 13, 294519;09:00:00;21:00:00;81610829797
клх Юрьевец (Иван.), ул. Тупиковая, д. 29, 514973;09:00:00;21:00:00;+7 (325) 860-8660
д. Кузнецк, ул. Серова, д. 77, 003615;09:00:00;21:00:00;+7 435 418 48 65
ст. Учалы, ул. Блюхера, д. 40, 578439;08:30:00;20:30:00;8 634 003 79 32
клх Воркута, ул. Красноярская, д. 52, 388614;08:00:00;20:00:00;8 285 131 5105
п. Терней, ул. Железнодорожная, д. 94, 875924;08:30:00;20:30:00;+77120975507
п. Подольск, ул. Коммунальная, д. 76, 439912;09:00:00;21:00:00;+72816473100
ст. Псебай, ул. Пионерская, д. 58, 928934;08:30:00;20:30:00;+79785726975
ст. Каспийск, ул. Ягодная, д. 28, 753897;08:30:00;20:30:00;8 204 995 8211
клх Темрюк, ул. Центральная, д. 48, 592558;09:00:00;21:00:00;+73511383610
ст. Усть-Камчатск, ул. Карла Либкнехта, д. 56, 608810;09:00:00;21:00:00;8 463 304 30 52
клх Россошь, ул. Нахимова, д. 89, 431796;08:30:00;20:30:00;+7 814 381 7423
ст. Северодвинск, ул. Азина, д. 88, 662276;08:30:00;20:30:00;+78486142403
с. Юровск, ул. Пирогова, д. 29, 835974;09:00:00;21:00:00;+7 (902) 385-2681
к. Касимов, ул. Чернышевского, д. 39, 153625;08:30:00;20:30:00;8 939 233 5825
г. Нижний Новгород, ул. Балтийская, д. 31, 125725;09:00:00;21:00:00;+7 666 473 0681
д. Ивдель, ул. Гоголя, д. 10, 257016;09:00:00;21:00:00;+7 434 538 4527
к. Ростов-на-Дону, ул. Кузнецкая, д. 01, 297636;09:00:00;21:00:00;87714060589
г. Белоярский, ул. Угольная, д. 40, 895323;08:30:00;20:30:00;+72311055012
ст. Кириши, ул. Союзная, д. 73, 254733;09:00:00;21:00:00;8 216 133 4158
д. Усть-Кут, ул. Хуторская, д. 51, 838104;08:00:00;20:00:00;8 210 715 32 36
д. Вязьма, ул. Красная, д. 61, 260484;09:00:00;21:00:00;+7 (868) 056-81-99
к. Минеральные Воды, ул. Песчаная, д. 71, 662897;09:00:00;21:00:00;+7 383 678 29 28
ст. Сочи, ул. Димитрова, д. 40, 576063;08:30:00;20:30:00;8 766 180 4449
ст. Псков, ул. Металлистов, д. 21, 384757;08:30:00;20:30:00;8 946 441 4710
к. Мыс Шмидта, ул. Покровская, д. 86, 818524;08:00:00;20:00:00;+7 (633) 673-1500
клх Чехов, ул. Черняховского, д. 78, 969873;08:00:00;20:00:00;8 (485) 336-78-05
с. Неплюевка, ул. Геологов, д. 60, 511372;08:00:00;20:00:00;8 (336) 164-5368
с. Байкальск, ул. Ильича, д. 45, 611446;09:00:00;21:00:00;85463771927
д. Катайск, ул. Коммунистическая, д. 11, 443401;08:00:00;20:00:00;8 (367) 429-59-59
с. Чебоксары, ул. Пирогова, д. 04, 921753;08:00:00;20:00:00;8 (205) 959-72-19
п. Соликамск, ул. Заречная, д. 03, 563089;09:00:00;21:00:00;+7 (921) 435-1280
ст. Муравленко, ул. Ленинская, д. 29, 711907;08:00:00;20:00:00;81698303143
г. Горно-Алтайск, ул. Главная, д. 65, 122226;08:00:00;20:00:00;88692917490
с. Лабинск, ул. Гастелло, д. 00, 685640;08:30:00;20:30:00;+71509811213
ст. Красновишерск, ул. Полевая, д. 82, 442030;08:30:00;20:30:00;+7 660 263 7204
д. Белоярский, ул. Волочаевская, д. 06, 296868;08:30:00;20:30:00;+76500138112
клх Усмань, ул. Кирпичная, д. 28, 081381;08:30:00;20:30:00;+7 925 410 0035
клх Кош-Агач, ул. Лесхозная, д. 18, 873053;08:30:00;20:30:00;+7 339 705 8790
ст. Рязань, ул. Омская, д. 14, 560797;08:30:00;20:30:00;+7 (448) 775-9104
д. Бреды, ул. Толстого, д. 02, 472207;08:30:00;20:30:00;8 460 184 6099
к. Архыз, ул. Семашко, д. 86, 194685;08:30:00;20:30:00;8 715 235 4830
с. Якша, ул. Высокая, д. 64, 567734;08:00:00;20:00:00;8 (692) 864-57-87
г. Южно-Сахалинск, ул. Садовая, д. 18, 855462;08:00:00;20:00:00;89102803129
г. Черемхово, ул. Черняховского, д. 85, 087146;08:30:00;20:30:00;8 (320) 877-68-69
ст. Пенза, ул. Жданова, д. 33, 877801;08:30:00;20:30:00;+7 774 525 61 03
ст. Курган, ул. Невского, д. 54, 107716;08:30:00;20:30:00;8 (598) 748-6092
п. Юровск, ул. Воровского, д. 10, 480091;08:00:00;20:00:00;+78059045373
п. Кисловодск, ул. Кутузова, д. 03, 245663;08:30:00;20:30:00;+7 (302) 232-6478
ст. Белгород, ул. Матросова, д. 18, 776911;08:30:00;20:30:00;8 (283) 433-4765
к. Добрянка, ул. Осипенко, д. 16, 393805;08:30:00;20:30:00;+7 935 822 1886
с. Кириши, ул. Станиславского, д. 52, 036984;09:00:00;21:00:00;+7 123 565 88 68
ст. Тихорецк, ул. Безымянная, д. 07, 927054;08:00:00;20:00:00;+7 963 993 0594
ст. Нарткала, ул. Крылова, д. 92, 451558;08:30:00;20:30:00;+7 340 943 52 04
с. Мостовской, ул. Клары Цеткин, д. 35, 262128;08:00:00;20:00:00;+7 (725) 234-8588
д. Лянтор, ул. Космическая, д. 14, 389677;09:00:00;21:00:00;+7 (008) 380-6123
п. Краснокамск, ул. Хвойная, д. 98, 158051;08:00:00;20:00:00;+7 (034) 535-14-43
с. Истра, ул. Куйбышева, д. 45, 809845;08:30:00;20:30:00;+7 854 978 7567
к. Иваново, ул. Абрикосовая, д. 09, 125397;08:30:00;20:30:00;8 178 127 05 74
ст. Асбест, ул. Радужная, д. 98, 267196;09:00:00;21:00:00;+7 (421) 473-66-24
п. Гагарин, ул. Высотная, д. 82, 895396;09:00:00;21:00:00;8 (728) 507-40-71
к. Соловки, ул. Никитина, д. 34, 602089;08:30:00;20:30:00;8 079 473 3573
с. Кетченеры, ул. Хвойная, д. 79, 008355;08:30:00;20:30:00;83446040801
д. Лесной (Сверд.), ул. Леонова, д. 62, 222787;09:00:00;21:00:00;+7 439 388 6414
г. Бийск, ул. Цветочная, д. 54, 940639;08:30:00;20:30:00;+7 (675) 357-38-59
к. Шелагонцы, ул. Макаренко, д. 09, 288870;08:30:00;20:30:00;+7 (575) 405-18-97
с. Ясный (Оренб.), ул. Маркса Карла, д. 35, 593278;08:30:00;20:30:00;8 (121) 369-7430
д. Бронницы, ул. Пархоменко, д. 06, 011939;08:30:00;20:30:00;81114480555
ст. Городовиковск, ул. Енисейская, д. 40, 355039;08:00:00;20:00:00;+7 (058) 816-72-97
клх Ессентуки, ул. Солнечная, д. 85, 868175;08:00:00;20:00:00;+7 844 553 78 15
ст. Томпа, ул. Маяковского, д. 77, 885230;08:30:00;20:30:00;8 (204) 960-0142
с. Поярково, ул. Восточная, д. 64, 330263;09:00:00;21:00:00;8 (644) 245-84-06
п. Тихорецк, ул. Строительная, д. 58, 824342;08:00:00;20:00:00;+7 (806) 395-0240
клх Верхнее Пенжино, ул. Победы, д. 25, 365791;08:00:00;20:00:00;8 981 923 61 68
п. Магас, ул. Социалистическая, д. 87, 340884;09:00:00;21:00:00;8 518 900 82 15
клх Волхов, ул. Трудовая, д. 16, 344005;08:00:00;20:00:00;84803469191
д. Королев, ул. Мусы Джалиля, д. 74, 822617;08:30:00;20:30:00;+7 521 555 7437
д. Шерегеш, ул. Прохладная, д. 19, 939360;08:30:00;20:30:00;8 (405) 012-84-57
с. Юрьев-Польский, ул. Жуковского, д. 10, 933950;08:00:00;20:00:00;+7 515 894 58 84
ст. Мыс Шмидта, ул. Глинки, д. 17, 573697;08:00:00;20:00:00;81739415921
клх Лабинск, ул. Осипенко, д. 91, 834065;09:00:00;21:00:00;8 637 705 0721
к. Выборг, ул. Есенина, д. 83, 450203;08:00:00;20:00:00;+7 658 867 87 34
клх Бийск, ул. Коллективная, д. 76, 519515;08:30:00;20:30:00;+7 198 929 09 64
клх Соловки, ул. Авиационная, д. 21, 537663;08:00:00;20:00:00;8 341 056 21 17
п. Карабулак, ул. Казанская, д. 46, 786270;08:30:00;20:30:00;+7 055 992 8649
клх Холмогоры, ул. Рязанская, д. 97, 723904;09:00:00;21:00:00;8 (030) 108-86-58
с. Братск, ул. Рабочая, д. 26, 643996;08:00:00;20:00:00;+7 (304) 552-13-69
п. Онега, ул. Шолохова, д. 61, 322087;08:00:00;20:00:00;8 (286) 834-4629
к. Малая Вишера, ул. Дарвина, д. 38, 613975;08:30:00;20:30:00;8 449 872 48 20
клх Малгобек, ул. Луговая, д. 41, 606664;09:00:00;21:00:00;+7 901 823 23 67
д. Любань, ул. Морозова, д. 48, 346385;08:00:00;20:00:00;8 027 534 5725
